<?xml version="1.0" encoding="UTF-8"?>
<homeland xmlns:xsi="http://www.w3.org/2001/XMLSchema-instance"
	xsi:noNamespaceSchemaLocation="../../validation/homeland.xsd">
	<name>test_homeland</name>
	<bonus>
		<traits>
			<trait>
				<name>honest</name>
				<value>2</value>
			</trait>
		</traits>
		<skills>
			<skill>
				<name>skill_1</name>
				<value>3</value>
			</skill>
			<skill>
				<name>skill_2</name>
				<descriptor>descriptor_skill_2</descriptor>
				<value>4</value>
			</skill>
		</skills>
		<specialty_skills>
			<skill>
				<name>specialty_skill_1</name>
				<value>5</value>
			</skill>
		</specialty_skills>
		<passions>
			<passion>
				<name>passion_1</name>
				<descriptor>descriptor_passion_1</descriptor>
			</passion>
		</passions>
		<directed_traits>
			<directed_trait>
				<name>directed_1</name>
				<descriptor>descriptor_directed_1</descriptor>
			</directed_trait>
		</directed_traits>
	</bonus>
</homeland>